"","from_id","from_name","message","created_time","type","link","id","story","likes_count","comments_count","shares_count"
"1","94971738769","Next","#WIN £1000 to spend at Next! <ed><U+00A0><U+00BD><ed><U+00B1><U+008C>

Ever catch a glimpse of yourself and think 'I've totally nailed my outfit today'?

We want to see your #NailedIt moments! Upload your pics to Instagram, using the hashtag and including @nextofficial. Comp ends 15th Dec.

Explore: ow.ly/7Amz30fGQER
T&Cs: ow.ly/HDAW30fGQBy","2017-11-01T17:30:00+0000","video","https://www.facebook.com/nextofficial/videos/10155790461863770/","94971738769_10155790461863770",NA,196,44,32
"2","94971738769","Next","Read up on how to #LookScarilyGood without ANY fake blood in sight <ed><U+00A0><U+00BD><ed><U+00B1><U+00BB><ed><U+00A0><U+00BC><ed><U+00BE><U+0083>","2017-10-27T17:11:00+0000","link","http://blog.next.co.uk/how-to-look-scarily-good","94971738769_10155793606393770",NA,31,7,0
"3","94971738769","Next","Celebrate Halloween the ghoulish way! 

Think pleather LBDs and fluffy accessories! 
Now THAT'S looking scarily good! ow.ly/N6Gz30fXQBS","2017-10-26T17:00:01+0000","video","https://www.facebook.com/nextofficial/videos/10155771258148770/","94971738769_10155771258148770",NA,27,1,0
"4","94971738769","Next",NA,"2017-10-23T08:29:41+0000","photo","https://www.facebook.com/nextofficial/photos/a.10150704315938770.416423.94971738769/10155784471328770/?type=3","94971738769_10155784471513770","Next updated their cover photo.",60,9,2
"5","94971738769","Next","Take your home to the next level of hygge (and instagrammability) <ed><U+00A0><U+00BD><ed><U+00B8><U+008D><ed><U+00A0><U+00BD><ed><U+00B8><U+0089>

ow.ly/A9YE30fPhSm","2017-10-22T15:00:00+0000","photo","https://www.facebook.com/nextofficial/photos/a.104416018769.91653.94971738769/10155748509208770/?type=3","94971738769_10155748510648770",NA,735,45,13
"6","94971738769","Next","Date night fashion tips for the messy eater... <ed><U+00A0><U+00BD><ed><U+00B8><U+0082>","2017-10-20T15:16:14+0000","link","http://blog.next.co.uk/date-night-dos-donts-for-messy-eaters","94971738769_10155776806113770",NA,32,1,1
"7","94971738769","Next","Congrats, Bab Butt! You're out winner <ed><U+00A0><U+00BD><ed><U+00B8><U+0084> Please PM us with your details!

GIVEAWAY TIME!

Ready to nail your office look?
For your chance to #WIN an outfit for you and your other half, comment below with the phrase ""Next Friday Giveaway – nailed it! "" and we'll announce the winner here on Monday <ed><U+00A0><U+00BD><ed><U+00B8><U+008A>

SHOP: ow.ly/5vAB30fM1lB
T&Cs: ow.ly/KoFo308cjEY","2017-10-13T07:00:00+0000","photo","https://www.facebook.com/nextofficial/photos/a.104416018769.91653.94971738769/10155743390783770/?type=3","94971738769_10155743392598770",NA,2117,2979,399
"8","94971738769","Next","When you can trade smart casual for casual casual.
#NailedIt","2017-10-12T10:00:00+0000","video","https://www.facebook.com/nextofficial/videos/10155728891528770/","94971738769_10155728891528770",NA,80,3,4
"9","94971738769","Next","Shop the ad: ow.ly/axZz30fJE8r","2017-10-09T09:00:00+0000","video","https://www.facebook.com/nextofficial/videos/10155728849133770/","94971738769_10155728849133770",NA,113,9,11
"10","94971738769","Next","#WIN £1000 to spend at Next! <ed><U+00A0><U+00BD><ed><U+00B1><U+008C> 

Ever catch a glimpse of yourself and think 'I've totally nailed my outfit today'? 

We want to see your #NailedIt moments! Upload your pics to Instagram, using the hashtag and including @nextofficial. Comp ends 15th Dec.

Explore: ow.ly/7Amz30fGQER
T&Cs: ow.ly/HDAW30fGQBy","2017-10-07T11:00:00+0000","video","https://www.facebook.com/nextofficial/videos/10155732260183770/","94971738769_10155732260183770",NA,225,33,50
"11","94971738769","Next",NA,"2017-10-05T09:30:59+0000","photo","https://www.facebook.com/nextofficial/photos/a.10150704315938770.416423.94971738769/10155728825638770/?type=3","94971738769_10155728826028770","Next updated their cover photo.",156,5,2
"12","94971738769","Next","Shop the ad here: ow.ly/W22830fBU3s","2017-10-03T19:00:00+0000","video","https://www.facebook.com/nextofficial/videos/10155720531808770/","94971738769_10155720531808770",NA,273,12,25
"13","94971738769","Next",NA,"2017-09-28T07:22:38+0000","photo","https://www.facebook.com/nextofficial/photos/a.10150704315938770.416423.94971738769/10155708896448770/?type=3","94971738769_10155708896828770","Next updated their cover photo.",360,22,5
"14","94971738769","Next","The #NextSale is ON! <ed><U+00A0><U+00BD><ed><U+00B0><U+00B6>
Tag your super shopping squad below!

Tap here to shop: http://ow.ly/RLfI30f7CyN","2017-09-23T07:30:00+0000","video","https://www.facebook.com/nextofficial/videos/10155667640763770/","94971738769_10155667640763770",NA,652,199,55
"15","94971738769","Next","Are you a pretty in pink, lovely lace or a floral fanatic kinda girl? Feel FAB on the inside with the prettiest of lingerie!

Lizzie Non Padded Longline Lace Balcony Bra £18 ow.ly/9yd830eZ2eW
Pink Daisy Non Wire Light Padded Lace Bra £16 ow.ly/wZQl30eZ2lV
Rose Print Silk Push Up Padded Plunge Bra £28 ow.ly/HWdr30eZ2mL
Lizzie Non Padded Lace Balcony Bra £14 ow.ly/ejnC30eZ2ok","2017-09-15T15:00:00+0000","video","https://www.facebook.com/nextofficial/videos/10155649464823770/","94971738769_10155649464823770",NA,122,7,3
"16","94971738769","Next","Look great > feel great > work out great <ed><U+00A0><U+00BD><ed><U+00B2><U+00AA><ed><U+00A0><U+00BC><ed><U+00BF><U+00BC>
<ed><U+00A0><U+00BD><ed><U+00B3><U+00B7> Le Fashion Fetish","2017-09-11T09:00:01+0000","photo","https://www.facebook.com/nextofficial/photos/a.104416018769.91653.94971738769/10155649164788770/?type=3","94971738769_10155649179258770","Next added 4 new photos.",511,18,13
"17","94971738769","Next","Congrats, Michelle Holder! You're our winner <ed><U+00A0><U+00BD><ed><U+00B8><U+008A> Please PM us with your details!

GIVEAWAY TIME!

Ready for rusty hues and cosy knits?

For your chance to #WIN this outfit, comment below with the phrase ""Next Friday Giveaway - I can't WAIT to strut in that!"" and we'll announce the winner here on Monday <ed><U+00A0><U+00BD><ed><U+00B8><U+008A>

SHOP: ow.ly/4O9k30eDQ5I
T&Cs: ow.ly/KoFo308cjEY","2017-09-01T07:00:01+0000","photo","https://www.facebook.com/nextofficial/photos/a.104416018769.91653.94971738769/10155608384758770/?type=3","94971738769_10155608387568770",NA,2215,2894,378
"18","94971738769","Next","Congrats, Carole Tonner! You're our winner <ed><U+00A0><U+00BD><ed><U+00B8><U+008A> Please PM us with your details!

GIVEAWAY TIME!

We *still* won't accept we're over halfway through summer, but we CAN help get you ahead of the game for autumn... 

For your chance to #WIN this outfit, comment below with the phrase ""Next Friday Giveaway - NEW wardrobe"" and we'll announce the winner here on Tuesday <ed><U+00A0><U+00BD><ed><U+00B8><U+008A>

T&Cs: ow.ly/KoFo308cjEY","2017-08-25T07:00:00+0000","photo","https://www.facebook.com/nextofficial/photos/a.104416018769.91653.94971738769/10155588362073770/?type=3","94971738769_10155588365073770",NA,3177,5188,570
"19","94971738769","Next","***Congrats, Philipa Pickering :) You're our winner!***

GIVEAWAY TIME!
Introducing your new dress-down Friday look!

For your chance to #WIN this outfit, comment below with the phrase ""Next Friday Giveaway - we love Fridays"" and we'll announce the winner here on Monday <ed><U+00A0><U+00BD><ed><U+00B8><U+008A>

SHOP: ow.ly/ZyIk30dYJzL 
T&Cs: ow.ly/KoFo308cjEY","2017-08-18T07:00:00+0000","photo","https://www.facebook.com/nextofficial/photos/a.104416018769.91653.94971738769/10155530837973770/?type=3","94971738769_10155530838388770",NA,2330,3296,439
"20","94971738769","Next","***Congrats, Jackie Bitton! You're our winner <ed><U+00A0><U+00BD><ed><U+00B8><U+008A> Please PM us with your details!***

GIVEAWAY TIME!
The champ of schoolwear!

For your chance to #WIN £100 to spend on our schoolwear, comment below with the phrase ""Next Friday Giveaway - uniform champ"" and we'll announce the winner here on Monday <ed><U+00A0><U+00BD><ed><U+00B8><U+008A>

SHOP: ow.ly/7pdr30dWYIm 
T&Cs: ow.ly/KoFo308cjEY","2017-08-11T07:00:01+0000","photo","https://www.facebook.com/nextofficial/photos/a.104416018769.91653.94971738769/10155527637493770/?type=3","94971738769_10155527637898770",NA,2238,3385,468
"21","94971738769","Next","Fancying some new arm candy?

Try these must-have bags for size!

ow.ly/hvir30dWXzr","2017-08-08T11:00:00+0000","video","https://www.facebook.com/nextofficial/videos/10155527617178770/","94971738769_10155527617178770",NA,318,8,12
"22","94971738769","Next","***Congrats, Rachael Casey! You're our winner <ed><U+00A0><U+00BD><ed><U+00B8><U+008A> Please PM us with your details***

GIVEAWAY TIME!

Think pink this wedding season!

For your chance to #WIN this look, comment below with the phrase ""Next Friday Giveaway - pretty in pink"" and we'll announce the winner here on Monday <ed><U+00A0><U+00BD><ed><U+00B8><U+008A>

Cold Shoulder Velvet Top £32
Pleated Tulle Skirt £48
ow.ly/ifxa30dTkjQ 
T&Cs: ow.ly/KoFo308cjEY","2017-08-04T07:00:01+0000","photo","https://www.facebook.com/nextofficial/photos/a.104416018769.91653.94971738769/10155520281458770/?type=3","94971738769_10155520281458770",NA,1568,2030,312
"23","94971738769","Next","***Congrats, Frances Haines! You're our winner <ed><U+00A0><U+00BD><ed><U+00B8><U+008A> Please PM us with your details***

GIVEAWAY TIME!

Get ahead of the game and bag your kids a brand NEW school look NOW!

For your chance to #WIN £100 to spend on uniform, comment below with the phrase ""Next Friday Giveaway - school uniform"" and we'll announce the winner here on Monday <ed><U+00A0><U+00BD><ed><U+00B8><U+008A>

SHOP: ow.ly/2Mff30dM32C
T&Cs: ow.ly/KoFo308cjEY","2017-07-28T07:00:00+0000","video","https://www.facebook.com/nextofficial/videos/10155501772278770/","94971738769_10155501772278770",NA,2846,4976,737
"24","94971738769","Next","Love it, wear it, share it! 

For the chance to win £100, show us your FAVE snaps featuring Next on Insta by tagging #ShareWithNext <ed><U+00A0><U+00BD><ed><U+00B8><U+008A>

Or head here to upload: 
ow.ly/rdp630doj8m","2017-07-14T15:00:00+0000","video","https://www.facebook.com/nextofficial/videos/10155449760713770/","94971738769_10155449760713770",NA,198,14,19
"25","94971738769","Next","Overwhelmed by all our fab NEW products? 

We’ve got EVERYTHING you need to know about our homeware range over on the blog: ow.ly/oOFj30dz48X","2017-07-12T15:00:01+0000","link","http://ow.ly/oOFj30dz48X","94971738769_10155471701858770",NA,70,34,1
"26","94971738769","Next","Early bird catches the worm!
Get a head start on your little one's NEW TERM clobber! 

SHOP: ow.ly/vEHE30d0JgB","2017-07-09T09:00:00+0000","video","https://www.facebook.com/nextofficial/videos/10155418712173770/","94971738769_10155418712173770",NA,160,5,12
"27","94971738769","Next","***Congrats, Isabelle Smith! You're our winner <ed><U+00A0><U+00BD><ed><U+00B8><U+0080> Please PM us with your details!***

GIVEAWAY TIME!
Wishing your wardrobe was summer ready? Look no further! 

For your chance to #WIN this whole look, comment below with the phrase 'Next Friday Giveaway - summer wardrobe update"" and we'll announce the winner here on Monday <ed><U+00A0><U+00BD><ed><U+00B8><U+008A>

SHOP: ow.ly/qelw30cAmt1 
T&Cs: ow.ly/KoFo308cjEY","2017-06-23T07:00:00+0000","photo","https://www.facebook.com/nextofficial/photos/a.104416018769.91653.94971738769/10155370949528770/?type=3","94971738769_10155370949528770",NA,2298,2874,374
"28","94971738769","Next","Get suited and booted *just* in time for wedding season!

SHOP: ow.ly/fPFp30cAhjl","2017-06-21T11:00:00+0000","video","https://www.facebook.com/nextofficial/videos/10155370884138770/","94971738769_10155370884138770",NA,56,2,3
"29","94971738769","Next","***Congrats, Natasha Photiou. You're our winner! Please PM us with your details***

GIVEAWAY TIME!

You've got the invite, now you need the dress! 
Wedding season is in full swing, so how would you like the chance to #WIN this look?

Comment below with the phrase 'Next Friday Giveaway - we love weddings!"" and we'll announce the winner here on Monday <ed><U+00A0><U+00BD><ed><U+00B8><U+008A>

Multi Wrap Dress £68 ow.ly/vjfs30cq5ZC 
T&Cs: ow.ly/KoFo308cjEY","2017-06-16T07:00:00+0000","photo","https://www.facebook.com/nextofficial/photos/a.104416018769.91653.94971738769/10155350744693770/?type=3","94971738769_10155350744693770",NA,2376,2868,369
"30","94971738769","Next","Inflatables at the ready - half term is heeeeere! 
Who's ready for some fun in the sun?

SHOP: ow.ly/zkge30bZOYD","2017-05-29T12:00:00+0000","video","https://www.facebook.com/nextofficial/videos/10155303145543770/","94971738769_10155303145543770",NA,125,4,5
"31","94971738769","Next","***Congrats Jodie Lea, you're our winner! <ed><U+00A0><U+00BD><ed><U+00B8><U+008A>***

GIVEAWAY TIME!
Let's give the cooler weather the cold shoulder and get set for <U+2600><U+FE0F>

To #WIN this whole look, comment below with the phrase “Next Friday Giveaway – get me summer ready!” and we’ll announce the winner here on Monday :) 

SHOP the look: ow.ly/Pdd930bseTA 
T&CS: ow.ly/KoFo308cjEY","2017-05-12T08:16:33+0000","photo","https://www.facebook.com/nextofficial/photos/a.104416018769.91653.94971738769/10155242264023770/?type=3","94971738769_10155242264023770",NA,1865,2205,345
"32","94971738769","Next","Fancy yourself as a street style photographer? Upload 3 shots featuring one Next item via the link below and if you’ve got what it takes – you could be joining us on a shoot in the US or Caribbean! #NextStreetStyle ow.ly/iTkP30bdAuq","2017-05-03T11:00:00+0000","video","https://www.facebook.com/nextofficial/videos/10155218962813770/","94971738769_10155218962813770",NA,381,16,12
"33","94971738769","Next","Wishing you a very happy Easter Sunday!

We hope you have an egg-cellent day! <ed><U+00A0><U+00BD><ed><U+00B0><U+00A3><ed><U+00A0><U+00BC><ed><U+00BD><U+00B3><ed><U+00A0><U+00BC><ed><U+00BC><U+00B8>","2017-04-16T08:00:00+0000","video","https://www.facebook.com/nextofficial/videos/10155175558598770/","94971738769_10155175558598770",NA,703,4,22
"34","94971738769","Next","Introducing nextunlimited - unlimited standard next day home delivery for just £20 a year!

More details here: ow.ly/Lgtw30aPjds","2017-04-13T10:31:50+0000","photo","https://www.facebook.com/nextofficial/photos/a.104416018769.91653.94971738769/10155174765938770/?type=3","94971738769_10155174765938770",NA,681,140,101
"35","94971738769","Next",NA,"2017-04-12T09:39:11+0000","photo","https://www.facebook.com/nextofficial/photos/a.10150704315938770.416423.94971738769/10155170602258770/?type=3","94971738769_10155170603113770","Next updated their cover photo.",942,17,17
"36","94971738769","Next","The weather is FINALLY getting the memo, so nail your spring style with our TOP tips on how to work your fave skirt and sweater over on the blog <ed><U+00A0><U+00BD><ed><U+00B1><U+0089><ed><U+00A0><U+00BC><ed><U+00BF><U+00BC> ow.ly/FKo230akenG","2017-03-30T13:18:54+0000","link","http://blog.next.co.uk/spring-solutions-sweater-skirt","94971738769_10155117325883770",NA,245,6,8
"37","94971738769","Next",NA,"2017-03-03T09:21:52+0000","photo","https://www.facebook.com/nextofficial/photos/a.10150704315938770.416423.94971738769/10155035848513770/?type=3","94971738769_10155035848998770","Next updated their cover photo.",418,9,10
"38","94971738769","Next","Wishing you could keep it *this* effortlessly casual today?

Utility Jacket £48 ow.ly/6qFd309krYv
Sweat Dress £30-£34 ow.ly/Wlbf309ks2h
Animal Print Leather Camera Bag £38 ow.ly/31WD309ks4V","2017-02-27T10:00:01+0000","photo","https://www.facebook.com/nextofficial/photos/a.104416018769.91653.94971738769/10155017923953770/?type=3","94971738769_10155017923953770",NA,1486,29,20
"39","94971738769","Next","Your BRAND NEW Next in Aintree is now OPEN <ed><U+00A0><U+00BD><ed><U+00B8><U+008D>
We can't wait to see you <ed><U+00A0><U+00BD><ed><U+00B8><U+0083>","2017-02-14T17:57:16+0000","photo","https://www.facebook.com/nextofficial/photos/a.104416018769.91653.94971738769/10154986404988770/?type=3","94971738769_10154986404988770",NA,2889,176,48
"40","94971738769","Next",NA,"2016-12-29T23:22:19+0000","photo","https://www.facebook.com/nextofficial/photos/a.10150704315938770.416423.94971738769/10154840626003770/?type=3","94971738769_10154840626823770","Next updated their cover photo.",714,38,21
"41","94971738769","Next",NA,"2016-12-23T12:01:42+0000","photo","https://www.facebook.com/nextofficial/photos/a.10150704315938770.416423.94971738769/10154816469028770/?type=3","94971738769_10154816473938770","Next updated their cover photo.",369,15,21
"42","94971738769","Next",NA,"2016-12-21T12:14:53+0000","photo","https://www.facebook.com/nextofficial/photos/a.10150704315938770.416423.94971738769/10154810137928770/?type=3","94971738769_10154810140738770","Next updated their cover photo.",344,12,11
