"","from_id","from_name","message","created_time","type","link","id","story","likes_count","comments_count","shares_count"
"1","32075534692","Oasis Fashion","A match made in velvety heaven <U+2665>

Pammy Paris Bag: http://fal.cn/qE2f
Velvet Kitty Boots: http://fal.cn/qE2b","2017-11-08T18:30:01+0000","photo","https://www.facebook.com/oasisfashions/photos/a.72522249692.71366.32075534692/10155700421579693/?type=3","32075534692_10155700444689693",NA,113,17,2
"2","32075534692","Oasis Fashion","Christmas has come early! 

Tell us if you prefer THIS Robin Knit or THAT Dachshund Jumper and you could WIN IT!","2017-11-08T12:30:05+0000","photo","https://www.facebook.com/oasisfashions/photos/a.72522249692.71366.32075534692/10155699877719693/?type=3","32075534692_10155699877719693",NA,1498,2229,307
"3","32075534692","Oasis Fashion","Why have one bobble when you can have two? http://fal.cn/q2WD","2017-11-08T07:45:02+0000","photo","https://www.facebook.com/oasisfashions/photos/a.72522249692.71366.32075534692/10155699398779693/?type=3","32075534692_10155699398779693",NA,69,7,3
"4","32075534692","Oasis Fashion","Okay... But if you HAD to choose one, which dress would it be?
Puff Sleeve Lace Dress: http://fal.cn/q2sP
Lace Metallic Skater: http://fal.cn/q2sp","2017-11-07T18:30:00+0000","photo","https://www.facebook.com/oasisfashions/photos/a.72522249692.71366.32075534692/10155697651519693/?type=3","32075534692_10155697666474693","Oasis Fashion added 2 new photos.",54,15,1
"5","32075534692","Oasis Fashion","On a scale of 1-10, how amazing is Holly Willoughby's outfit?

Shop our leather dress and get the look - http://fal.cn/qKeN","2017-11-07T10:05:50+0000","photo","https://www.facebook.com/oasisfashions/photos/a.72522249692.71366.32075534692/10155696792709693/?type=3","32075534692_10155696796594693",NA,636,44,12
"6","32075534692","Oasis Fashion","Seven iconic classics reimagined in sumptuous shades of red; Meet Midi, Glitzy, Fancy, Shimmy, Lacy, Prom and Bow. Shop the limited edition collection before it's too late - http://fal.cn/qKmR","2017-11-07T09:30:03+0000","photo","https://www.facebook.com/oasisfashions/photos/a.72522249692.71366.32075534692/10155696746554693/?type=3","32075534692_10155696746554693",NA,130,2,7
"7","32075534692","Oasis Fashion","Wide leg trousers? Workwear never looked so good... http://fal.cn/qK9d","2017-11-06T18:00:01+0000","photo","https://www.facebook.com/oasisfashions/photos/a.72522249692.71366.32075534692/10155694619294693/?type=3","32075534692_10155694673544693",NA,39,0,1
"8","32075534692","Oasis Fashion","Black and white needn't be boring...
Shop the coat - http://fal.cn/qKNB
Shop the skirt - http://fal.cn/qKNE","2017-11-06T07:45:03+0000","photo","https://www.facebook.com/oasisfashions/photos/a.72522249692.71366.32075534692/10155694134299693/?type=3","32075534692_10155694134299693",NA,115,3,2
"9","32075534692","Oasis Fashion","What better way to add a little sparkle to Bonfire Night? http://fal.cn/qKBQ","2017-11-05T08:30:09+0000","video","https://www.facebook.com/oasisfashions/videos/10155691587869693/","32075534692_10155691587889693",NA,143,4,2
"10","32075534692","Oasis Fashion","It's time to get your bobble on (in every colour imaginable). http://fal.cn/q8fG","2017-11-04T08:30:01+0000","photo","https://www.facebook.com/oasisfashions/photos/a.72522249692.71366.32075534692/10155683980959693/?type=3","32075534692_10155683983134693",NA,145,17,3
"11","32075534692","Oasis Fashion","Friday night twinning at its finest. (Heels: 63215 / Bag: 63366) http://fal.cn/q8ve","2017-11-03T18:00:00+0000","photo","https://www.facebook.com/oasisfashions/photos/a.72522249692.71366.32075534692/10155683975929693/?type=3","32075534692_10155683979064693",NA,174,22,4
"12","32075534692","Oasis Fashion","Your party season wardrobe is set to get the ultimate transformation thanks to our enchanting collaboration with Nottingham Trent University. Shop the collection here: http://fal.cn/qB21","2017-11-03T08:00:25+0000","photo","https://www.facebook.com/oasisfashions/photos/a.72522249692.71366.32075534692/10155686198764693/?type=3","32075534692_10155686198764693",NA,86,2,8
"13","32075534692","Oasis Fashion","Spreading print, colour and happiness. This is #OasisFashion your way. Upload your image on Instagram and tag #oasisfashion for your chance to win a £50 gift card!","2017-11-02T15:10:18+0000","photo","https://www.facebook.com/oasisfashions/photos/a.10155640235919693.1073742293.32075534692/10155684471019693/?type=3","32075534692_10155684471019693","Oasis Fashion added 6 new photos.",197,5,6
"14","32075534692","Oasis Fashion","We've got just the trick to keep you stylish and snug on those chilly winter evenings. Shop our new lounge and sleepwear range here: http://fal.cn/q8Yg","2017-11-02T08:00:04+0000","photo","https://www.facebook.com/oasisfashions/photos/a.72522249692.71366.32075534692/10155683730964693/?type=3","32075534692_10155683730964693",NA,200,9,4
"15","32075534692","Oasis Fashion","Want to be our next Sunday Girl?

If you’re free at the start of December and you’d LOVE to be the star of our feature, then we need YOU! 

Just tell us why you should be a Sunday Girl and four lucky winners will WIN a spot in our December feature AND a £50 Oasis voucher…","2017-11-01T17:23:42+0000","photo","https://www.facebook.com/oasisfashions/photos/a.72522249692.71366.32075534692/10155682195054693/?type=3","32075534692_10155682196804693",NA,59,69,7
"16","32075534692","Oasis Fashion","Because you just HAVE TO HAVE these...

Tell us if you prefer THIS Reversible Parka Coat or THAT Cosy Padded Coat and you could WIN IT!","2017-11-01T12:15:02+0000","photo","https://www.facebook.com/oasisfashions/photos/a.72522249692.71366.32075534692/10155681409359693/?type=3","32075534692_10155681409359693",NA,2427,3424,646
"17","32075534692","Oasis Fashion","Bundle up this Bonfire Night and get 20% off all padded coats and parkas online with the code 'TOASTY20' <ed><U+00A0><U+00BC><ed><U+00BD><U+0082>. Follow the link to shop: http://fal.cn/tesU","2017-10-31T14:00:14+0000","photo","https://www.facebook.com/oasisfashions/photos/a.72522249692.71366.32075534692/10155678461304693/?type=3","32075534692_10155678461304693",NA,61,5,2
"18","32075534692","Oasis Fashion","The question is, to trick or to treat? Happy Halloween <ed><U+00A0><U+00BD><ed><U+00B1><U+00BB>. http://fal.cn/te2c","2017-10-31T08:00:11+0000","photo","https://www.facebook.com/oasisfashions/photos/a.72522249692.71366.32075534692/10155677863529693/?type=3","32075534692_10155677863529693",NA,22,1,0
"19","32075534692","Oasis Fashion","Put your best foot forward in this season's must-have boots. The question is, which pair to choose? http://fal.cn/tkOw","2017-10-30T18:00:01+0000","photo","https://www.facebook.com/oasisfashions/photos/a.72522249692.71366.32075534692/10155676191164693/?type=3","32075534692_10155676196544693","Oasis Fashion added 2 new photos.",170,12,2
"20","32075534692","Oasis Fashion","Monday mornings done right... Rose lattes all round at Saucer & Spritz  in Tottenham Court Road <ed><U+00A0><U+00BC><ed><U+00BC><U+00B9>","2017-10-30T08:00:15+0000","photo","https://www.facebook.com/oasisfashions/photos/a.72522249692.71366.32075534692/10155675245669693/?type=3","32075534692_10155675245669693",NA,78,8,3
"21","32075534692","Oasis Fashion","The definition of fashionably late: forgetting to adjust the hands on your brand-new Oasis watch. #clocksgoback http://fal.cn/tkqT","2017-10-29T08:30:09+0000","video","https://www.facebook.com/oasisfashions/videos/10155672664679693/","32075534692_10155672664709693",NA,8,1,0
"22","32075534692","Oasis Fashion","Remember, remember, the 5th of November (because it's time to start outfit planning)... Shop our cute and colourful knits online: http://fal.cn/tmRT","2017-10-28T09:30:13+0000","video","https://www.facebook.com/oasisfashions/videos/10155670145904693/","32075534692_10155670145974693",NA,226,10,3
"23","32075534692","Oasis Fashion","Officially OOO. 

Dress - http://fal.cn/tmTO
Bag - http://fal.cn/tmTR","2017-10-27T16:30:02+0000","photo","https://www.facebook.com/oasisfashions/photos/a.72522249692.71366.32075534692/10155668244069693/?type=3","32075534692_10155668252079693",NA,112,6,0
"24","32075534692","Oasis Fashion","Stay stylish (and snug) this Autumn in our chic checked scarf. http://fal.cn/tmuQ","2017-10-27T07:15:03+0000","photo","https://www.facebook.com/oasisfashions/photos/a.72522249692.71366.32075534692/10155667479349693/?type=3","32075534692_10155667479349693",NA,122,2,3
"25","32075534692","Oasis Fashion","There's 30% off selected styles online so move quickly and grab these purse-friendly picks before someone else definitely does! 

Browse our seasonal offers here: http://fal.cn/tcRL","2017-10-26T18:00:27+0000","photo","https://www.facebook.com/oasisfashions/photos/a.72522249692.71366.32075534692/10155666027949693/?type=3","32075534692_10155666027949693",NA,66,4,2
"26","32075534692","Oasis Fashion","Stunning jacquard and jewel-tones, it's ALL about Delphina. http://fal.cn/tc03","2017-10-26T11:40:20+0000","photo","https://www.facebook.com/oasisfashions/photos/a.72522249692.71366.32075534692/10155665279029693/?type=3","32075534692_10155665280569693",NA,41,2,0
"27","32075534692","Oasis Fashion","If it ain't broke, don't fix it. This season's must-have hue, it's red all the way this Autumn.

Click the image to shop the collection.","2017-10-25T16:41:41+0000","photo","https://www.facebook.com/oasisfashions/photos/a.72522249692.71366.32075534692/10155663371629693/?type=3","32075534692_10155663402839693",NA,56,0,3
"28","32075534692","Oasis Fashion","Because you just HAVE TO HAVE these...
 Tell us if you prefer THIS Velvet Sleeve Tee or THAT Choker Tee and you could WIN IT!","2017-10-25T11:30:02+0000","photo","https://www.facebook.com/oasisfashions/photos/a.72522249692.71366.32075534692/10155662696919693/?type=3","32075534692_10155662696919693",NA,865,1175,168
"29","32075534692","Oasis Fashion","The moment you've all been waiting for, our Oxford store is now open! 

From partywear to winter warmers, discover our collections in-store.

Find us at:
209 Westgate Oxford
Queen Street
OX1 1PE","2017-10-24T16:35:53+0000","photo","https://www.facebook.com/oasisfashions/photos/a.72522249692.71366.32075534692/10155660270779693/?type=3","32075534692_10155660319284693","Oasis Fashion is in Oxford, Oxfordshire.",133,3,2
"30","32075534692","Oasis Fashion","A fresh take on Autumn styling, we love this mint crew teamed with our pastel check scarf!

Shop the knit: http://fal.cn/tnSa
Shop the scarf: http://fal.cn/tnSM","2017-10-24T11:26:38+0000","photo","https://www.facebook.com/oasisfashions/photos/a.72522249692.71366.32075534692/10155659640694693/?type=3","32075534692_10155659647799693",NA,94,0,0
"31","32075534692","Oasis Fashion","Our best-selling Cord Dress has just arrived in a brand-new colour! 

Dress ACCORDINGLY and get it before it's gone! http://fal.cn/tz5m","2017-10-23T17:30:01+0000","photo","https://www.facebook.com/oasisfashions/photos/a.72522249692.71366.32075534692/10155657363254693/?type=3","32075534692_10155657367399693","Oasis Fashion added 3 new photos.",69,3,1
"32","32075534692","Oasis Fashion","Meet Robert, the winner of our Nottingham Trent University design competition. His dreamy black and pink lace dress, complete with flattering plunge neck, won your hearts and votes. 

We sat down to chat everything from style inspiration to studying fashion and how it feels to win our competition and see his design come to life in our enchanting new collaboration.","2017-10-23T12:03:24+0000","link","http://www.oasis-stores.com/gb/blog/a-qa-with-robert-our-winning-ntu-lace-designer.html","32075534692_10155657325614693",NA,12,0,0
"33","32075534692","Oasis Fashion","Spreading print, colour and happiness. This is #OasisFashion your way. Upload your image on Instagram and tag #oasisfashion for your chance to win a £50 gift card!","2017-10-23T10:26:21+0000","photo","https://www.facebook.com/oasisfashions/photos/a.10155640235919693.1073742293.32075534692/10155657158484693/?type=3","32075534692_10155657158484693","Oasis Fashion added 5 new photos.",197,5,6
"34","32075534692","Oasis Fashion","Get your glitter on with these super cute socks and add some sparkle wherever you step. http://fal.cn/tC.Z","2017-10-23T07:00:01+0000","photo","https://www.facebook.com/oasisfashions/photos/a.72522249692.71366.32075534692/10155650066819693/?type=3","32075534692_10155650091239693",NA,35,4,0
"35","32075534692","Oasis Fashion","Your party season wardrobe is set to get the ultimate transformation thanks to our enchanting new collaboration with Nottingham Trent University’s lace archives. 

Discover ladylike lace and jewel-tone jacquard in a coveted collection of dreamy dresses and stunning separates all party-season perfect. 

Shop the collection online today and in-stores from Tuesday 24th October... http://fal.cn/tCA0","2017-10-22T08:00:00+0000","photo","https://www.facebook.com/oasisfashions/photos/a.72522249692.71366.32075534692/10155649671809693/?type=3","32075534692_10155649676729693",NA,88,5,11
"36","32075534692","Oasis Fashion","Luxury in lilac... Invest in this leather clutch for style that doesn't fade. http://fal.cn/tCYb","2017-10-21T11:05:01+0000","photo","https://www.facebook.com/oasisfashions/photos/a.72522249692.71366.32075534692/10155650088689693/?type=3","32075534692_10155650108479693",NA,53,0,2
"37","32075534692","Oasis Fashion","We're opening our doors in Oxford!

Join us on the 24th October at the soon-to-open shopping centre, Westgate Oxford, and toast a hard day's shopping with bubbles and sweet treats...

And if that wasn't enough of an incentive, our first 50 customers will also receive a free gift!

Find us at:
209 The Westgate
Queen Street
Oxford 
OX1 1PE","2017-10-20T14:15:14+0000","photo","https://www.facebook.com/oasisfashions/photos/a.72522249692.71366.32075534692/10155650181914693/?type=3","32075534692_10155650208409693",NA,253,20,25
"38","32075534692","Oasis Fashion","If you like Pina Coladas, and hiding out from the rain… We LOVE these tropical touches at our Tottenham Court Road café, Saucer & Spritz. Whether for a coffee or a cocktail, pop-in for a spot of post-shopping TLC.

Find us at:
22 Tottenham Court Road
London
W1T 1BJ

http://fal.cn/tCNF","2017-10-20T11:40:04+0000","photo","https://www.facebook.com/oasisfashions/photos/a.72522249692.71366.32075534692/10155649853124693/?type=3","32075534692_10155649853124693",NA,83,15,1
"39","32075534692","Oasis Fashion","Pastels so good you can't pick between them. Guess we'll have to take them both... http://fal.cn/twDh","2017-10-20T07:00:00+0000","photo","https://www.facebook.com/oasisfashions/photos/a.72522249692.71366.32075534692/10155647772599693/?type=3","32075534692_10155647778299693",NA,45,2,2
"40","32075534692","Oasis Fashion","From office to out-out, you need this LBD in your life! http://fal.cn/twR6","2017-10-19T17:00:01+0000","photo","https://www.facebook.com/oasisfashions/photos/a.72522249692.71366.32075534692/10155647662584693/?type=3","32075534692_10155647663799693","Oasis Fashion added 2 new photos.",172,4,2
"41","32075534692","Oasis Fashion","Sweeter than honey, you need this Bumble Bee crew. 

But even sweeter still, you can shop it online with 30% off! http://fal.cn/twMg

Megan Taylor itsmegantaylor","2017-10-19T12:48:13+0000","photo","https://www.facebook.com/oasisfashions/photos/a.72522249692.71366.32075534692/10155647309129693/?type=3","32075534692_10155647317264693",NA,281,38,3
"42","32075534692","Oasis Fashion","Forget about grey skies, frosty days and chilly evenings… Make a bright statement instead! http://fal.cn/tw2d","2017-10-18T17:00:00+0000","photo","https://www.facebook.com/oasisfashions/photos/a.72522249692.71366.32075534692/10155644418384693/?type=3","32075534692_10155644420574693",NA,207,23,6
"43","32075534692","Oasis Fashion","Because you just HAVE TO HAVE these...

Tell us if you prefer THIS Check Coat or THAT Faux Fur Collar Coat and you could WIN IT!","2017-10-18T11:30:08+0000","photo","https://www.facebook.com/oasisfashions/photos/a.72522249692.71366.32075534692/10155644449489693/?type=3","32075534692_10155644449489693",NA,1739,2647,348
"44","32075534692","Oasis Fashion","We don't mean to alarm you, but there's an amazing 30% off these classic Oasis pieces online!

Move fast and grab these purse-friendly picks before someone else definitely does!

Browse our seasonal offers: http://fal.cn/tDFX","2017-10-17T15:32:42+0000","photo","https://www.facebook.com/oasisfashions/photos/a.72522249692.71366.32075534692/10155642498524693/?type=3","32075534692_10155642508684693","Oasis Fashion added 3 new photos.",163,7,6
"45","32075534692","Oasis Fashion","Pair this colour block knit with our faded straight leg jeans for chic style made simple. 

Click the image to shop the look.","2017-10-17T10:31:26+0000","photo","https://www.facebook.com/oasisfashions/photos/a.72522249692.71366.32075534692/10155641962089693/?type=3","32075534692_10155641968434693",NA,90,2,4
"46","32075534692","Oasis Fashion","Spreading print, colour and happiness. This is #OasisFashion your way. Upload your image on Instagram and tag #oasisfashion for your chance to win a £50 gift card!","2017-10-16T15:30:57+0000","photo","https://www.facebook.com/oasisfashions/photos/a.10155640235919693.1073742293.32075534692/10155640236014693/?type=3","32075534692_10155640236014693","Oasis Fashion added 8 new photos.",197,5,6
"47","32075534692","Oasis Fashion","In Autumn's must-have hue, nail casual chic with this cosy knit. http://fal.cn/t7mZ","2017-10-16T14:04:31+0000","photo","https://www.facebook.com/oasisfashions/photos/a.72522249692.71366.32075534692/10155640069639693/?type=3","32075534692_10155640088114693",NA,50,0,5
"48","32075534692","Oasis Fashion","Don't forget, you can still shop our sale with an extra 20% off using code 'CHAPTER20'! http://fal.cn/t7f5","2017-10-15T09:30:02+0000","photo","https://www.facebook.com/oasisfashions/photos/a.72522249692.71366.32075534692/10155637247834693/?type=3","32075534692_10155637247834693",NA,33,1,5
"49","32075534692","Oasis Fashion","Dressed up or down, you can't go wrong with our Essie ankle boots. The question is, black or burgundy? http://fal.cn/t7NC","2017-10-14T14:00:21+0000","video","https://www.facebook.com/oasisfashions/videos/10155635090119693/","32075534692_10155635090119693",NA,137,11,4
"50","32075534692","Oasis Fashion","Because understated is underrated. 

Shop our neutral knits - http://fal.cn/tR2X","2017-10-12T08:50:10+0000","video","https://www.facebook.com/oasisfashions/videos/10155629918169693/","32075534692_10155629918169693",NA,132,1,6
"51","32075534692","Oasis Fashion","A Sale to Tell: now up to 70% off, plus an extra 20% off sale online with code: ‘CHAPTER20’! http://fal.cn/tOg3","2017-10-11T16:47:10+0000","video","https://www.facebook.com/oasisfashions/videos/10155628414614693/","32075534692_10155628414614693",NA,80,10,4
"52","32075534692","Oasis Fashion","Because you just HAVE TO HAVE these. 

Tell us if you prefer THIS floral wrap dress or THAT black velvet dress and you could WIN IT.","2017-10-11T11:30:01+0000","photo","https://www.facebook.com/oasisfashions/photos/a.72522249692.71366.32075534692/10155625776489693/?type=3","32075534692_10155625782324693",NA,1167,1727,194
"53","32075534692","Oasis Fashion","Don't miss our Book & Brunch Club!

This Sunday, we’re hosting the third and final wonderful reading with Katie Khan, author of Hold Back the Stars.

Where? 
Saucer & Spritz - the in-store café at Oasis Tottenham Court Road

When? 
12-2pm, Sunday 15th October

Tickets are £20, and include a £20 Oasis gift card, a signed book, brunch and bottomless mimosas.

Book now: http://fal.cn/tvXo","2017-10-11T08:00:01+0000","photo","https://www.facebook.com/oasisfashions/photos/a.72522249692.71366.32075534692/10155625763034693/?type=3","32075534692_10155625768264693",NA,22,2,2
"54","32075534692","Oasis Fashion","We'll take them all. 

Shop the Kitty Ankle Boot now: http://fal.cn/tvrK","2017-10-10T11:22:09+0000","video","https://www.facebook.com/oasisfashions/videos/10155625406104693/","32075534692_10155625406104693",NA,219,18,6
"55","32075534692","Oasis Fashion","Enter code 'CHAPTER20' for an extra 20% off sale online! http://bit.ly/2v9NCTa","2017-10-10T10:14:54+0000","photo","https://www.facebook.com/oasisfashions/photos/a.72522249692.71366.32075534692/10155625307259693/?type=3","32075534692_10155625309404693",NA,59,11,3
"56","32075534692","Oasis Fashion","Meet Phoebe, your winter wardrobe BFF. Side Split Phoebe Jumper: 62223 http://bit.ly/2yzBX4C","2017-10-09T16:30:04+0000","photo","https://www.facebook.com/oasisfashions/photos/a.72522249692.71366.32075534692/10155623339149693/?type=3","32075534692_10155623339149693",NA,125,5,2
"57","32075534692","Oasis Fashion","Staying cosy is a walk in the park this season thanks to our dreamy colour block knit. http://fal.cn/tgr1","2017-10-08T10:30:02+0000","photo","https://www.facebook.com/oasisfashions/photos/a.72522249692.71366.32075534692/10155620112659693/?type=3","32075534692_10155620112659693",NA,144,8,2
"58","32075534692","Oasis Fashion","Ready to go wild? No problem. http://fal.cn/tlOS","2017-10-07T08:00:17+0000","photo","https://www.facebook.com/oasisfashions/photos/a.72522249692.71366.32075534692/10155617296739693/?type=3","32075534692_10155617296739693",NA,70,6,3
"59","32075534692","Oasis Fashion","A little birdy tells us velvet and teal are a match made in fashion heaven. And who are we to disagree? http://bit.ly/2xX6h8K","2017-10-06T07:40:01+0000","photo","https://www.facebook.com/oasisfashions/photos/a.72522249692.71366.32075534692/10155614852694693/?type=3","32075534692_10155614852694693",NA,58,3,3
"60","32075534692","Oasis Fashion","The Oasis Book & Brunch Club continues this Saturday! 

Join us this Saturday 10-12pm at Saucer & Spritz, the in-house café at Oasis Tottenham Court Road for an unforgettable reading with Caz Frear, author of Sweet Little Lies.

Tickets are £20 and also include:
- A signed book
- A tasty brunch
- And bottomless Mimosas… how perfect!

Pick up your tickets here for a bubbly Saturday morning: http://fal.cn/t3IZ","2017-10-05T11:30:02+0000","photo","https://www.facebook.com/oasisfashions/photos/a.72522249692.71366.32075534692/10155612759324693/?type=3","32075534692_10155612759324693",NA,8,0,1
"61","32075534692","Oasis Fashion","Have you heard? Our UP TO 50% OFF sale just got SO much better…http://www.oasis-stores.com/gb/all-sale/","2017-10-04T15:25:01+0000","photo","https://www.facebook.com/oasisfashions/photos/a.72522249692.71366.32075534692/10155610834809693/?type=3","32075534692_10155610834809693",NA,54,0,3
"62","32075534692","Oasis Fashion","Because you just HAVE TO HAVE these. Tell us if you prefer THIS colour block knit or THAT oversized perfect crew and you could WIN IT.","2017-10-04T11:28:01+0000","photo","https://www.facebook.com/oasisfashions/photos/a.72522249692.71366.32075534692/10155610275694693/?type=3","32075534692_10155610275694693",NA,1104,1512,221
"63","32075534692","Oasis Fashion","Classic camel and a take-it-or-leave-it faux fur collar… travel in style this season with this beauty! http://www.oasis-stores.com/gb/clothing/jackets-coats/fran-shawl-fur-collar-coat/062802.html","2017-10-03T17:00:32+0000","photo","https://www.facebook.com/oasisfashions/photos/a.72522249692.71366.32075534692/10155608506464693/?type=3","32075534692_10155608506464693",NA,182,9,3
"64","32075534692","Oasis Fashion","DON’T MISS OUR BOOK & BRUNCH CLUB!

This Saturday we’re hosting the second of three wonderful readings…

MEET: Caz Frear,  author of Sweet Little Lies

WHERE: Saucer & Spritz - the in-store cafe at Oasis Tottenham Court Road

WHEN: 10-12pm, Saturday 7th October

Tickets are £20, and include a £20 OASIS GIFT CARD, A SIGNED BOOK, BRUNCH AND BOTTOMLESS MIMOSAS.

BOOK NOW >

http://www.oasis-stores.com/gb/bookclub.html?id=38039561352","2017-10-03T16:00:20+0000","photo","https://www.facebook.com/oasisfashions/photos/a.72522249692.71366.32075534692/10155608385534693/?type=3","32075534692_10155608385534693",NA,76,2,1
"65","32075534692","Oasis Fashion","For denim that pops, look no further. Flawless fit and divine details make your dream jeans a reality. http://www.oasis-stores.com/gb/clothing/denim/","2017-10-01T13:00:16+0000","photo","https://www.facebook.com/oasisfashions/photos/a.72522249692.71366.32075534692/10155603049454693/?type=3","32075534692_10155603049454693",NA,133,14,4
"66","32075534692","Oasis Fashion","The prettiest detachable faux fur collar in dreamy dove grey… it’s no wonder we’ve taken to calling this gorgeous coat the Princess… http://www.oasis-stores.com/gb/clothing/jackets-coats/olivia-princess-coat/062228.html?dwvar_062228_color=14","2017-09-30T14:00:22+0000","photo","https://www.facebook.com/oasisfashions/photos/a.72522249692.71366.32075534692/10155600743614693/?type=3","32075534692_10155600743614693",NA,210,9,7
"67","32075534692","Oasis Fashion","Smart and sleek, your workday commute just got a whole lot more stylish…  http://www.oasis-stores.com/gb/clothing/jackets-coats/melissa-skater/061930.html?","2017-09-29T13:00:34+0000","photo","https://www.facebook.com/oasisfashions/photos/a.72522249692.71366.32075534692/10155598036209693/?type=3","32075534692_10155598036209693",NA,104,0,2
"68","32075534692","Oasis Fashion","The Oasis Book & Brunch Club starts this Sunday! 

Join us at Saucer & Spritz, the in-house cafe at Oasis Tottenham Court Road for an unforgettable reading with Laura Marshall, author of Friend Request, PLUS...

- A signed book
- A delicious brunch
- And bottomless mimosas... hoorah!

Tickets are £20 and you can book online here: http://fal.cn/t_52","2017-09-28T17:12:23+0000","photo","https://www.facebook.com/oasisfashions/photos/a.72522249692.71366.32075534692/10155596186674693/?type=3","32075534692_10155596186674693",NA,29,8,1
